<?xml version="1.0" encoding="UTF-8"?>
<!-- Test data for ID selection and pattern matching (could be enlarged) -->
<!-- a elements id1, id3, id5, id7, id9 are filled out with b elements.
     a elements id2, id4, id6, are filled out with b and c elements.
     Within a element id8,
       id81, id82, id83, id85, id86, id87, id89 are filled out with b, c elements;
       id80, id84, id88 are filled out with b, c, d elements;
       id888 is further filled with b, c, d, e elements. -->
<!DOCTYPE doc [
  <!ELEMENT doc (#PCDATA|a)*>
  <!ATTLIST doc id ID #REQUIRED>
  <!ELEMENT a (#PCDATA|b)*>
  <!ATTLIST a id ID #REQUIRED>
  <!ELEMENT b (#PCDATA|c)*>
  <!ATTLIST b id ID #REQUIRED>
  <!ELEMENT c (#PCDATA|d)*>
  <!ATTLIST c id ID #REQUIRED >
  <!ELEMENT d (#PCDATA|e)*>
  <!ATTLIST d id ID #REQUIRED >
]>
<doc id="id0">
  <a id="id1">
    *id1*
    <b id="id10">*id10*</b>
    <b id="id11">*id11*</b>
    <b id="id12">*id12*</b>
    <b id="id13">*id13*</b>
    <b id="id14">*id14*</b>
    <b id="id15">*id15*</b>
    <b id="id16">*id16*</b>
    <b id="id17">*id17*</b>
    <b id="id18">*id18*</b>
    <b id="id19">*id19*</b>
  </a>
  <a id="id2">
    *id2*
    <b id="id20">*id20*
      <c id="id200">*id200*</c>
      <c id="id201">*id201*</c>
      <c id="id202">*id202*</c>
      <c id="id203">*id203*</c>
      <c id="id204">*id204*</c>
      <c id="id205">*id205*</c>
      <c id="id206">*id206*</c>
      <c id="id207">*id207*</c>
      <c id="id208">*id208*</c>
      <c id="id209">*id209*</c>
    </b>
    <b id="id21">*id21*
      <c id="id210">*id210*</c>
      <c id="id211">*id211*</c>
      <c id="id212">*id212*</c>
      <c id="id213">*id213*</c>
      <c id="id214">*id214*</c>
      <c id="id215">*id215*</c>
      <c id="id216">*id216*</c>
      <c id="id217">*id217*</c>
      <c id="id218">*id218*</c>
      <c id="id219">*id219*</c>
    </b>
    <b id="id22">*id22*
      <c id="id220">*id220*</c>
      <c id="id221">*id221*</c>
      <c id="id222">*id222*</c>
      <c id="id223">*id223*</c>
      <c id="id224">*id224*</c>
      <c id="id225">*id225*</c>
      <c id="id226">*id226*</c>
      <c id="id227">*id227*</c>
      <c id="id228">*id228*</c>
      <c id="id229">*id229*</c>
    </b>
    <b id="id23">*id23*
      <c id="id230">*id230*</c>
      <c id="id231">*id231*</c>
      <c id="id232">*id232*</c>
      <c id="id233">*id233*</c>
      <c id="id234">*id234*</c>
      <c id="id235">*id235*</c>
      <c id="id236">*id236*</c>
      <c id="id237">*id237*</c>
      <c id="id238">*id238*</c>
      <c id="id239">*id239*</c>
    </b>
    <b id="id24">*id24*
      <c id="id240">*id240*</c>
      <c id="id241">*id241*</c>
      <c id="id242">*id242*</c>
      <c id="id243">*id243*</c>
      <c id="id244">*id244*</c>
      <c id="id245">*id245*</c>
      <c id="id246">*id246*</c>
      <c id="id247">*id247*</c>
      <c id="id248">*id248*</c>
      <c id="id249">*id249*</c>
    </b>
    <b id="id25">*id25*
      <c id="id250">*id250*</c>
      <c id="id251">*id251*</c>
      <c id="id252">*id252*</c>
      <c id="id253">*id253*</c>
      <c id="id254">*id254*</c>
      <c id="id255">*id255*</c>
      <c id="id256">*id256*</c>
      <c id="id257">*id257*</c>
      <c id="id258">*id258*</c>
      <c id="id259">*id259*</c>
    </b>
    <b id="id26">*id26*
      <c id="id260">*id260*</c>
      <c id="id261">*id261*</c>
      <c id="id262">*id262*</c>
      <c id="id263">*id263*</c>
      <c id="id264">*id264*</c>
      <c id="id265">*id265*</c>
      <c id="id266">*id266*</c>
      <c id="id267">*id267*</c>
      <c id="id268">*id268*</c>
      <c id="id269">*id269*</c>
    </b>
    <b id="id27">*id27*
      <c id="id270">*id270*</c>
      <c id="id271">*id271*</c>
      <c id="id272">*id272*</c>
      <c id="id273">*id273*</c>
      <c id="id274">*id274*</c>
      <c id="id275">*id275*</c>
      <c id="id276">*id276*</c>
      <c id="id277">*id277*</c>
      <c id="id278">*id278*</c>
      <c id="id279">*id279*</c>
    </b>
    <b id="id28">*id28*
      <c id="id280">*id280*</c>
      <c id="id281">*id281*</c>
      <c id="id282">*id282*</c>
      <c id="id283">*id283*</c>
      <c id="id284">*id284*</c>
      <c id="id285">*id285*</c>
      <c id="id286">*id286*</c>
      <c id="id287">*id287*</c>
      <c id="id288">*id288*</c>
      <c id="id289">*id289*</c>
    </b>
    <b id="id29">*id29*
      <c id="id290">*id290*</c>
      <c id="id291">*id291*</c>
      <c id="id292">*id292*</c>
      <c id="id293">*id293*</c>
      <c id="id294">*id294*</c>
      <c id="id295">*id295*</c>
      <c id="id296">*id296*</c>
      <c id="id297">*id297*</c>
      <c id="id298">*id298*</c>
      <c id="id299">*id299*</c>
    </b>
  </a>
  <a id="id3">
    *id3*
    <b id="id30">*id30*</b>
    <b id="id31">*id31*</b>
    <b id="id32">*id32*</b>
    <b id="id33">*id33*</b>
    <b id="id34">*id34*</b>
    <b id="id35">*id35*</b>
    <b id="id36">*id36*</b>
    <b id="id37">*id37*</b>
    <b id="id38">*id38*</b>
    <b id="id39">*id39*</b>
  </a>
  <a id="id4">
    *id4*
    <b id="id40">*id40*
      <c id="id400">*id400*</c>
      <c id="id401">*id401*</c>
      <c id="id402">*id402*</c>
      <c id="id403">*id403*</c>
      <c id="id404">*id404*</c>
      <c id="id405">*id405*</c>
      <c id="id406">*id406*</c>
      <c id="id407">*id407*</c>
      <c id="id408">*id408*</c>
      <c id="id409">*id409*</c>
    </b>
    <b id="id41">*id41*
      <c id="id410">*id410*</c>
      <c id="id411">*id411*</c>
      <c id="id412">*id412*</c>
      <c id="id413">*id413*</c>
      <c id="id414">*id414*</c>
      <c id="id415">*id415*</c>
      <c id="id416">*id416*</c>
      <c id="id417">*id417*</c>
      <c id="id418">*id418*</c>
      <c id="id419">*id419*</c>
    </b>
    <b id="id42">*id42*
      <c id="id420">*id420*</c>
      <c id="id421">*id421*</c>
      <c id="id422">*id422*</c>
      <c id="id423">*id423*</c>
      <c id="id424">*id424*</c>
      <c id="id425">*id425*</c>
      <c id="id426">*id426*</c>
      <c id="id427">*id427*</c>
      <c id="id428">*id428*</c>
      <c id="id429">*id429*</c>
    </b>
    <b id="id43">*id43*
      <c id="id430">*id430*</c>
      <c id="id431">*id431*</c>
      <c id="id432">*id432*</c>
      <c id="id433">*id433*</c>
      <c id="id434">*id434*</c>
      <c id="id435">*id435*</c>
      <c id="id436">*id436*</c>
      <c id="id437">*id437*</c>
      <c id="id438">*id438*</c>
      <c id="id439">*id439*</c>
    </b>
    <b id="id44">*id44*
      <c id="id440">*id440*</c>
      <c id="id441">*id441*</c>
      <c id="id442">*id442*</c>
      <c id="id443">*id443*</c>
      <c id="id444">*id444*</c>
      <c id="id445">*id445*</c>
      <c id="id446">*id446*</c>
      <c id="id447">*id447*</c>
      <c id="id448">*id448*</c>
      <c id="id449">*id449*</c>
    </b>
    <b id="id45">*id45*
      <c id="id450">*id450*</c>
      <c id="id451">*id451*</c>
      <c id="id452">*id452*</c>
      <c id="id453">*id453*</c>
      <c id="id454">*id454*</c>
      <c id="id455">*id455*</c>
      <c id="id456">*id456*</c>
      <c id="id457">*id457*</c>
      <c id="id458">*id458*</c>
      <c id="id459">*id459*</c>
    </b>
    <b id="id46">*id46*
      <c id="id460">*id460*</c>
      <c id="id461">*id461*</c>
      <c id="id462">*id462*</c>
      <c id="id463">*id463*</c>
      <c id="id464">*id464*</c>
      <c id="id465">*id465*</c>
      <c id="id466">*id466*</c>
      <c id="id467">*id467*</c>
      <c id="id468">*id468*</c>
      <c id="id469">*id469*</c>
    </b>
    <b id="id47">*id47*
      <c id="id470">*id470*</c>
      <c id="id471">*id471*</c>
      <c id="id472">*id472*</c>
      <c id="id473">*id473*</c>
      <c id="id474">*id474*</c>
      <c id="id475">*id475*</c>
      <c id="id476">*id476*</c>
      <c id="id477">*id477*</c>
      <c id="id478">*id478*</c>
      <c id="id479">*id479*</c>
    </b>
    <b id="id48">*id48*
      <c id="id480">*id480*</c>
      <c id="id481">*id481*</c>
      <c id="id482">*id482*</c>
      <c id="id483">*id483*</c>
      <c id="id484">*id484*</c>
      <c id="id485">*id485*</c>
      <c id="id486">*id486*</c>
      <c id="id487">*id487*</c>
      <c id="id488">*id488*</c>
      <c id="id489">*id489*</c>
    </b>
    <b id="id49">*id49*
      <c id="id490">*id490*</c>
      <c id="id491">*id491*</c>
      <c id="id492">*id492*</c>
      <c id="id493">*id493*</c>
      <c id="id494">*id494*</c>
      <c id="id495">*id495*</c>
      <c id="id496">*id496*</c>
      <c id="id497">*id497*</c>
      <c id="id498">*id498*</c>
      <c id="id499">*id499*</c>
    </b>
  </a>
  <a id="id5">
    *id5*
    <b id="id50">*id50*</b>
    <b id="id51">*id51*</b>
    <b id="id52">*id52*</b>
    <b id="id53">*id53*</b>
    <b id="id54">*id54*</b>
    <b id="id55">*id55*</b>
    <b id="id56">*id56*</b>
    <b id="id57">*id57*</b>
    <b id="id58">*id58*</b>
    <b id="id59">*id59*</b>
  </a>
  <a id="id6">
    *id6*
    <b id="id60">*id60*
      <c id="id600">*id600*</c>
      <c id="id601">*id601*</c>
      <c id="id602">*id602*</c>
      <c id="id603">*id603*</c>
      <c id="id604">*id604*</c>
      <c id="id605">*id605*</c>
      <c id="id606">*id606*</c>
      <c id="id607">*id607*</c>
      <c id="id608">*id608*</c>
      <c id="id609">*id609*</c>
    </b>
    <b id="id61">*id61*
      <c id="id610">*id610*</c>
      <c id="id611">*id611*</c>
      <c id="id612">*id612*</c>
      <c id="id613">*id613*</c>
      <c id="id614">*id614*</c>
      <c id="id615">*id615*</c>
      <c id="id616">*id616*</c>
      <c id="id617">*id617*</c>
      <c id="id618">*id618*</c>
      <c id="id619">*id619*</c>
    </b>
    <b id="id62">*id62*
      <c id="id620">*id620*</c>
      <c id="id621">*id621*</c>
      <c id="id622">*id622*</c>
      <c id="id623">*id623*</c>
      <c id="id624">*id624*</c>
      <c id="id625">*id625*</c>
      <c id="id626">*id626*</c>
      <c id="id627">*id627*</c>
      <c id="id628">*id628*</c>
      <c id="id629">*id629*</c>
    </b>
    <b id="id63">*id63*
      <c id="id630">*id630*</c>
      <c id="id631">*id631*</c>
      <c id="id632">*id632*</c>
      <c id="id633">*id633*</c>
      <c id="id634">*id634*</c>
      <c id="id635">*id635*</c>
      <c id="id636">*id636*</c>
      <c id="id637">*id637*</c>
      <c id="id638">*id638*</c>
      <c id="id639">*id639*</c>
    </b>
    <b id="id64">*id64*
      <c id="id640">*id640*</c>
      <c id="id641">*id641*</c>
      <c id="id642">*id642*</c>
      <c id="id643">*id643*</c>
      <c id="id644">*id644*</c>
      <c id="id645">*id645*</c>
      <c id="id646">*id646*</c>
      <c id="id647">*id647*</c>
      <c id="id648">*id648*</c>
      <c id="id649">*id649*</c>
    </b>
    <b id="id65">*id65*
      <c id="id650">*id650*</c>
      <c id="id651">*id651*</c>
      <c id="id652">*id652*</c>
      <c id="id653">*id653*</c>
      <c id="id654">*id654*</c>
      <c id="id655">*id655*</c>
      <c id="id656">*id656*</c>
      <c id="id657">*id657*</c>
      <c id="id658">*id658*</c>
      <c id="id659">*id659*</c>
    </b>
    <b id="id66">*id66*
      <c id="id660">*id660*</c>
      <c id="id661">*id661*</c>
      <c id="id662">*id662*</c>
      <c id="id663">*id663*</c>
      <c id="id664">*id664*</c>
      <c id="id665">*id665*</c>
      <c id="id666">*id666*</c>
      <c id="id667">*id667*</c>
      <c id="id668">*id668*</c>
      <c id="id669">*id669*</c>
    </b>
    <b id="id67">*id67*
      <c id="id670">*id670*</c>
      <c id="id671">*id671*</c>
      <c id="id672">*id672*</c>
      <c id="id673">*id673*</c>
      <c id="id674">*id674*</c>
      <c id="id675">*id675*</c>
      <c id="id676">*id676*</c>
      <c id="id677">*id677*</c>
      <c id="id678">*id678*</c>
      <c id="id679">*id679*</c>
    </b>
    <b id="id68">*id68*
      <c id="id680">*id680*</c>
      <c id="id681">*id681*</c>
      <c id="id682">*id682*</c>
      <c id="id683">*id683*</c>
      <c id="id684">*id684*</c>
      <c id="id685">*id685*</c>
      <c id="id686">*id686*</c>
      <c id="id687">*id687*</c>
      <c id="id688">*id688*</c>
      <c id="id689">*id689*</c>
    </b>
    <b id="id69">*id69*
      <c id="id690">*id690*</c>
      <c id="id691">*id691*</c>
      <c id="id692">*id692*</c>
      <c id="id693">*id693*</c>
      <c id="id694">*id694*</c>
      <c id="id695">*id695*</c>
      <c id="id696">*id696*</c>
      <c id="id697">*id697*</c>
      <c id="id698">*id698*</c>
      <c id="id699">*id699*</c>
    </b>
  </a>
  <a id="id7">
    *id7*
    <b id="id70">*id70*</b>
    <b id="id71">*id71*</b>
    <b id="id72">*id72*</b>
    <b id="id73">*id73*</b>
    <b id="id74">*id74*</b>
    <b id="id75">*id75*</b>
    <b id="id76">*id76*</b>
    <b id="id77">*id77*</b>
    <b id="id78">*id78*</b>
    <b id="id79">*id79*</b>
  </a>
  <a id="id8">
    *id8*
    <b id="id80">*id80*
      <c id="id800">*id800*
        <d id="id8000">*id8000*</d>
        <d id="id8001">*id8001*</d>
        <d id="id8002">*id8002*</d>
        <d id="id8003">*id8003*</d>
        <d id="id8004">*id8004*</d>
        <d id="id8005">*id8005*</d>
        <d id="id8006">*id8006*</d>
        <d id="id8007">*id8007*</d>
        <d id="id8008">*id8008*</d>
        <d id="id8009">*id8009*</d>
      </c>
      <c id="id801">*id801*
        <d id="id8010">*id8010*</d>
        <d id="id8011">*id8011*</d>
        <d id="id8012">*id8012*</d>
        <d id="id8013">*id8013*</d>
        <d id="id8014">*id8014*</d>
        <d id="id8015">*id8015*</d>
        <d id="id8016">*id8016*</d>
        <d id="id8017">*id8017*</d>
        <d id="id8018">*id8018*</d>
        <d id="id8019">*id8019*</d>
      </c>
      <c id="id802">*id802*
        <d id="id8020">*id8020*</d>
        <d id="id8021">*id8021*</d>
        <d id="id8022">*id8022*</d>
        <d id="id8023">*id8023*</d>
        <d id="id8024">*id8024*</d>
        <d id="id8025">*id8025*</d>
        <d id="id8026">*id8026*</d>
        <d id="id8027">*id8027*</d>
        <d id="id8028">*id8028*</d>
        <d id="id8029">*id8029*</d>
      </c>
      <c id="id803">*id803*
        <d id="id8030">*id8030*</d>
        <d id="id8031">*id8031*</d>
        <d id="id8032">*id8032*</d>
        <d id="id8033">*id8033*</d>
        <d id="id8034">*id8034*</d>
        <d id="id8035">*id8035*</d>
        <d id="id8036">*id8036*</d>
        <d id="id8037">*id8037*</d>
        <d id="id8038">*id8038*</d>
        <d id="id8039">*id8039*</d>
      </c>
      <c id="id804">*id804*
        <d id="id8040">*id8040*</d>
        <d id="id8041">*id8041*</d>
        <d id="id8042">*id8042*</d>
        <d id="id8043">*id8043*</d>
        <d id="id8044">*id8044*</d>
        <d id="id8045">*id8045*</d>
        <d id="id8046">*id8046*</d>
        <d id="id8047">*id8047*</d>
        <d id="id8048">*id8048*</d>
        <d id="id8049">*id8049*</d>
      </c>
      <c id="id805">*id805*
        <d id="id8050">*id8050*</d>
        <d id="id8051">*id8051*</d>
        <d id="id8052">*id8052*</d>
        <d id="id8053">*id8053*</d>
        <d id="id8054">*id8054*</d>
        <d id="id8055">*id8055*</d>
        <d id="id8056">*id8056*</d>
        <d id="id8057">*id8057*</d>
        <d id="id8058">*id8058*</d>
        <d id="id8059">*id8059*</d>
      </c>
      <c id="id806">*id806*
        <d id="id8060">*id8060*</d>
        <d id="id8061">*id8061*</d>
        <d id="id8062">*id8062*</d>
        <d id="id8063">*id8063*</d>
        <d id="id8064">*id8064*</d>
        <d id="id8065">*id8065*</d>
        <d id="id8066">*id8066*</d>
        <d id="id8067">*id8067*</d>
        <d id="id8068">*id8068*</d>
        <d id="id8069">*id8069*</d>
      </c>
      <c id="id807">*id807*
        <d id="id8070">*id8070*</d>
        <d id="id8071">*id8071*</d>
        <d id="id8072">*id8072*</d>
        <d id="id8073">*id8073*</d>
        <d id="id8074">*id8074*</d>
        <d id="id8075">*id8075*</d>
        <d id="id8076">*id8076*</d>
        <d id="id8077">*id8077*</d>
        <d id="id8078">*id8078*</d>
        <d id="id8079">*id8079*</d>
      </c>
      <c id="id808">*id808*
        <d id="id8080">*id8080*</d>
        <d id="id8081">*id8081*</d>
        <d id="id8082">*id8082*</d>
        <d id="id8083">*id8083*</d>
        <d id="id8084">*id8084*</d>
        <d id="id8085">*id8085*</d>
        <d id="id8086">*id8086*</d>
        <d id="id8087">*id8087*</d>
        <d id="id8088">*id8088*</d>
        <d id="id8089">*id8089*</d>
      </c>
      <c id="id809">*id809*
        <d id="id8090">*id8090*</d>
        <d id="id8091">*id8091*</d>
        <d id="id8092">*id8092*</d>
        <d id="id8093">*id8093*</d>
        <d id="id8094">*id8094*</d>
        <d id="id8095">*id8095*</d>
        <d id="id8096">*id8096*</d>
        <d id="id8097">*id8097*</d>
        <d id="id8098">*id8098*</d>
        <d id="id8099">*id8099*</d>
      </c>
    </b>
    <b id="id81">*id81*
      <c id="id810">*id810*</c>
      <c id="id811">*id811*</c>
      <c id="id812">*id812*</c>
      <c id="id813">*id813*</c>
      <c id="id814">*id814*</c>
      <c id="id815">*id815*</c>
      <c id="id816">*id816*</c>
      <c id="id817">*id817*</c>
      <c id="id818">*id818*</c>
      <c id="id819">*id819*</c>
    </b>
    <b id="id82">*id82*
      <c id="id820">*id820*</c>
      <c id="id821">*id821*</c>
      <c id="id822">*id822*</c>
      <c id="id823">*id823*</c>
      <c id="id824">*id824*</c>
      <c id="id825">*id825*</c>
      <c id="id826">*id826*</c>
      <c id="id827">*id827*</c>
      <c id="id828">*id828*</c>
      <c id="id829">*id829*</c>
    </b>
    <b id="id83">*id83*
      <c id="id830">*id830*</c>
      <c id="id831">*id831*</c>
      <c id="id832">*id832*</c>
      <c id="id833">*id833*</c>
      <c id="id834">*id834*</c>
      <c id="id835">*id835*</c>
      <c id="id836">*id836*</c>
      <c id="id837">*id837*</c>
      <c id="id838">*id838*</c>
      <c id="id839">*id839*</c>
    </b>
    <b id="id84">*id84*
      <c id="id840">*id840*
        <d id="id8400">*id8400*</d>
        <d id="id8401">*id8401*</d>
        <d id="id8402">*id8402*</d>
        <d id="id8403">*id8403*</d>
        <d id="id8404">*id8404*</d>
        <d id="id8405">*id8405*</d>
        <d id="id8406">*id8406*</d>
        <d id="id8407">*id8407*</d>
        <d id="id8408">*id8408*</d>
        <d id="id8409">*id8409*</d>
      </c>
      <c id="id841">*id841*
        <d id="id8410">*id8410*</d>
        <d id="id8411">*id8411*</d>
        <d id="id8412">*id8412*</d>
        <d id="id8413">*id8413*</d>
        <d id="id8414">*id8414*</d>
        <d id="id8415">*id8415*</d>
        <d id="id8416">*id8416*</d>
        <d id="id8417">*id8417*</d>
        <d id="id8418">*id8418*</d>
        <d id="id8419">*id8419*</d>
      </c>
      <c id="id842">*id842*
        <d id="id8420">*id8420*</d>
        <d id="id8421">*id8421*</d>
        <d id="id8422">*id8422*</d>
        <d id="id8423">*id8423*</d>
        <d id="id8424">*id8424*</d>
        <d id="id8425">*id8425*</d>
        <d id="id8426">*id8426*</d>
        <d id="id8427">*id8427*</d>
        <d id="id8428">*id8428*</d>
        <d id="id8429">*id8429*</d>
      </c>
      <c id="id843">*id843*
        <d id="id8430">*id8430*</d>
        <d id="id8431">*id8431*</d>
        <d id="id8432">*id8432*</d>
        <d id="id8433">*id8433*</d>
        <d id="id8434">*id8434*</d>
        <d id="id8435">*id8435*</d>
        <d id="id8436">*id8436*</d>
        <d id="id8437">*id8437*</d>
        <d id="id8438">*id8438*</d>
        <d id="id8439">*id8439*</d>
      </c>
      <c id="id844">*id844*
        <d id="id8440">*id8440*</d>
        <d id="id8441">*id8441*</d>
        <d id="id8442">*id8442*</d>
        <d id="id8443">*id8443*</d>
        <d id="id8444">*id8444*</d>
        <d id="id8445">*id8445*</d>
        <d id="id8446">*id8446*</d>
        <d id="id8447">*id8447*</d>
        <d id="id8448">*id8448*</d>
        <d id="id8449">*id8449*</d>
      </c>
      <c id="id845">*id845*
        <d id="id8450">*id8450*</d>
        <d id="id8451">*id8451*</d>
        <d id="id8452">*id8452*</d>
        <d id="id8453">*id8453*</d>
        <d id="id8454">*id8454*</d>
        <d id="id8455">*id8455*</d>
        <d id="id8456">*id8456*</d>
        <d id="id8457">*id8457*</d>
        <d id="id8458">*id8458*</d>
        <d id="id8459">*id8459*</d>
      </c>
      <c id="id846">*id846*
        <d id="id8460">*id8460*</d>
        <d id="id8461">*id8461*</d>
        <d id="id8462">*id8462*</d>
        <d id="id8463">*id8463*</d>
        <d id="id8464">*id8464*</d>
        <d id="id8465">*id8465*</d>
        <d id="id8466">*id8466*</d>
        <d id="id8467">*id8467*</d>
        <d id="id8468">*id8468*</d>
        <d id="id8469">*id8469*</d>
      </c>
      <c id="id847">*id847*
        <d id="id8470">*id8470*</d>
        <d id="id8471">*id8471*</d>
        <d id="id8472">*id8472*</d>
        <d id="id8473">*id8473*</d>
        <d id="id8474">*id8474*</d>
        <d id="id8475">*id8475*</d>
        <d id="id8476">*id8476*</d>
        <d id="id8477">*id8477*</d>
        <d id="id8478">*id8478*</d>
        <d id="id8479">*id8479*</d>
      </c>
      <c id="id848">*id848*
        <d id="id8480">*id8480*</d>
        <d id="id8481">*id8481*</d>
        <d id="id8482">*id8482*</d>
        <d id="id8483">*id8483*</d>
        <d id="id8484">*id8484*</d>
        <d id="id8485">*id8485*</d>
        <d id="id8486">*id8486*</d>
        <d id="id8487">*id8487*</d>
        <d id="id8488">*id8488*</d>
        <d id="id8489">*id8489*</d>
      </c>
      <c id="id849">*id849*
        <d id="id8490">*id8490*</d>
        <d id="id8491">*id8491*</d>
        <d id="id8492">*id8492*</d>
        <d id="id8493">*id8493*</d>
        <d id="id8494">*id8494*</d>
        <d id="id8495">*id8495*</d>
        <d id="id8496">*id8496*</d>
        <d id="id8497">*id8497*</d>
        <d id="id8498">*id8498*</d>
        <d id="id8499">*id8499*</d>
      </c>
    </b>
    <b id="id85">*id85*
      <c id="id850">*id850*</c>
      <c id="id851">*id851*</c>
      <c id="id852">*id852*</c>
      <c id="id853">*id853*</c>
      <c id="id854">*id854*</c>
      <c id="id855">*id855*</c>
      <c id="id856">*id856*</c>
      <c id="id857">*id857*</c>
      <c id="id858">*id858*</c>
      <c id="id859">*id859*</c>
    </b>
    <b id="id86">*id86*
      <c id="id860">*id860*</c>
      <c id="id861">*id861*</c>
      <c id="id862">*id862*</c>
      <c id="id863">*id863*</c>
      <c id="id864">*id864*</c>
      <c id="id865">*id865*</c>
      <c id="id866">*id866*</c>
      <c id="id867">*id867*</c>
      <c id="id868">*id868*</c>
      <c id="id869">*id869*</c>
    </b>
    <b id="id87">*id87*
      <c id="id870">*id870*</c>
      <c id="id871">*id871*</c>
      <c id="id872">*id872*</c>
      <c id="id873">*id873*</c>
      <c id="id874">*id874*</c>
      <c id="id875">*id875*</c>
      <c id="id876">*id876*</c>
      <c id="id877">*id877*</c>
      <c id="id878">*id878*</c>
      <c id="id879">*id879*</c>
    </b>
    <b id="id88">*id88*
      <c id="id880">*id880*
        <d id="id8800">*id8800*</d>
        <d id="id8801">*id8801*</d>
        <d id="id8802">*id8802*</d>
        <d id="id8803">*id8803*</d>
        <d id="id8804">*id8804*</d>
        <d id="id8805">*id8805*</d>
        <d id="id8806">*id8806*</d>
        <d id="id8807">*id8807*</d>
        <d id="id8808">*id8808*</d>
        <d id="id8809">*id8809*</d>
      </c>
      <c id="id881">*id881*
        <d id="id8810">*id8810*</d>
        <d id="id8811">*id8811*</d>
        <d id="id8812">*id8812*</d>
        <d id="id8813">*id8813*</d>
        <d id="id8814">*id8814*</d>
        <d id="id8815">*id8815*</d>
        <d id="id8816">*id8816*</d>
        <d id="id8817">*id8817*</d>
        <d id="id8818">*id8818*</d>
        <d id="id8819">*id8819*</d>
      </c>
      <c id="id882">*id882*
        <d id="id8820">*id8820*</d>
        <d id="id8821">*id8821*</d>
        <d id="id8822">*id8822*</d>
        <d id="id8823">*id8823*</d>
        <d id="id8824">*id8824*</d>
        <d id="id8825">*id8825*</d>
        <d id="id8826">*id8826*</d>
        <d id="id8827">*id8827*</d>
        <d id="id8828">*id8828*</d>
        <d id="id8829">*id8829*</d>
      </c>
      <c id="id883">*id883*
        <d id="id8830">*id8830*</d>
        <d id="id8831">*id8831*</d>
        <d id="id8832">*id8832*</d>
        <d id="id8833">*id8833*</d>
        <d id="id8834">*id8834*</d>
        <d id="id8835">*id8835*</d>
        <d id="id8836">*id8836*</d>
        <d id="id8837">*id8837*</d>
        <d id="id8838">*id8838*</d>
        <d id="id8839">*id8839*</d>
      </c>
      <c id="id884">*id884*
        <d id="id8840">*id8840*</d>
        <d id="id8841">*id8841*</d>
        <d id="id8842">*id8842*</d>
        <d id="id8843">*id8843*</d>
        <d id="id8844">*id8844*</d>
        <d id="id8845">*id8845*</d>
        <d id="id8846">*id8846*</d>
        <d id="id8847">*id8847*</d>
        <d id="id8848">*id8848*</d>
        <d id="id8849">*id8849*</d>
      </c>
      <c id="id885">*id885*
        <d id="id8850">*id8850*</d>
        <d id="id8851">*id8851*</d>
        <d id="id8852">*id8852*</d>
        <d id="id8853">*id8853*</d>
        <d id="id8854">*id8854*</d>
        <d id="id8855">*id8855*</d>
        <d id="id8856">*id8856*</d>
        <d id="id8857">*id8857*</d>
        <d id="id8858">*id8858*</d>
        <d id="id8859">*id8859*</d>
      </c>
      <c id="id886">*id886*
        <d id="id8860">*id8860*</d>
        <d id="id8861">*id8861*</d>
        <d id="id8862">*id8862*</d>
        <d id="id8863">*id8863*</d>
        <d id="id8864">*id8864*</d>
        <d id="id8865">*id8865*</d>
        <d id="id8866">*id8866*</d>
        <d id="id8867">*id8867*</d>
        <d id="id8868">*id8868*</d>
        <d id="id8869">*id8869*</d>
      </c>
      <c id="id887">*id887*
        <d id="id8870">*id8870*</d>
        <d id="id8871">*id8871*</d>
        <d id="id8872">*id8872*</d>
        <d id="id8873">*id8873*</d>
        <d id="id8874">*id8874*</d>
        <d id="id8875">*id8875*</d>
        <d id="id8876">*id8876*</d>
        <d id="id8877">*id8877*</d>
        <d id="id8878">*id8878*</d>
        <d id="id8879">*id8879*</d>
      </c>
      <c id="id888">*id888*
         <d id="id8880">*id8880*
          <e id="id88800">*id88800*</e>
          <e id="id88801">*id88801*</e>
          <e id="id88802">*id88802*</e>
          <e id="id88803">*id88803*</e>
          <e id="id88804">*id88804*</e>
          <e id="id88805">*id88805*</e>
          <e id="id88806">*id88806*</e>
          <e id="id88807">*id88807*</e>
          <e id="id88808">*id88808*</e>
          <e id="id88809">*id88809*</e>
        </d>
        <d id="id8881">*id8881*
          <e id="id88810">*id88810*</e>
          <e id="id88811">*id88811*</e>
          <e id="id88812">*id88812*</e>
          <e id="id88813">*id88813*</e>
          <e id="id88814">*id88814*</e>
          <e id="id88815">*id88815*</e>
          <e id="id88816">*id88816*</e>
          <e id="id88817">*id88817*</e>
          <e id="id88818">*id88818*</e>
          <e id="id88819">*id88819*</e>
        </d>
        <d id="id8882">*id8882*
          <e id="id88820">*id88820*</e>
          <e id="id88821">*id88821*</e>
          <e id="id88822">*id88822*</e>
          <e id="id88823">*id88823*</e>
          <e id="id88824">*id88824*</e>
          <e id="id88825">*id88825*</e>
          <e id="id88826">*id88826*</e>
          <e id="id88827">*id88827*</e>
          <e id="id88828">*id88828*</e>
          <e id="id88829">*id88829*</e>
        </d>
        <d id="id8883">*id8883*
          <e id="id88830">*id88830*</e>
          <e id="id88831">*id88831*</e>
          <e id="id88832">*id88832*</e>
          <e id="id88833">*id88833*</e>
          <e id="id88834">*id88834*</e>
          <e id="id88835">*id88835*</e>
          <e id="id88836">*id88836*</e>
          <e id="id88837">*id88837*</e>
          <e id="id88838">*id88838*</e>
          <e id="id88839">*id88839*</e>
        </d>
        <d id="id8884">*id8884*
          <e id="id88840">*id88840*</e>
          <e id="id88841">*id88841*</e>
          <e id="id88842">*id88842*</e>
          <e id="id88843">*id88843*</e>
          <e id="id88844">*id88844*</e>
          <e id="id88845">*id88845*</e>
          <e id="id88846">*id88846*</e>
          <e id="id88847">*id88847*</e>
          <e id="id88848">*id88848*</e>
          <e id="id88849">*id88849*</e>
        </d>
        <d id="id8885">*id8885*
          <e id="id88850">*id88850*</e>
          <e id="id88851">*id88851*</e>
          <e id="id88852">*id88852*</e>
          <e id="id88853">*id88853*</e>
          <e id="id88854">*id88854*</e>
          <e id="id88855">*id88855*</e>
          <e id="id88856">*id88856*</e>
          <e id="id88857">*id88857*</e>
          <e id="id88858">*id88858*</e>
          <e id="id88859">*id88859*</e>
        </d>
        <d id="id8886">*id8886*
          <e id="id88860">*id88860*</e>
          <e id="id88861">*id88861*</e>
          <e id="id88862">*id88862*</e>
          <e id="id88863">*id88863*</e>
          <e id="id88864">*id88864*</e>
          <e id="id88865">*id88865*</e>
          <e id="id88866">*id88866*</e>
          <e id="id88867">*id88867*</e>
          <e id="id88868">*id88868*</e>
          <e id="id88869">*id88869*</e>
        </d>
        <d id="id8887">*id8887*
          <e id="id88870">*id88870*</e>
          <e id="id88871">*id88871*</e>
          <e id="id88872">*id88872*</e>
          <e id="id88873">*id88873*</e>
          <e id="id88874">*id88874*</e>
          <e id="id88875">*id88875*</e>
          <e id="id88876">*id88876*</e>
          <e id="id88877">*id88877*</e>
          <e id="id88878">*id88878*</e>
          <e id="id88879">*id88879*</e>
        </d>
        <d id="id8888">*id8888*
          <e id="id88880">*id88880*</e>
          <e id="id88881">*id88881*</e>
          <e id="id88882">*id88882*</e>
          <e id="id88883">*id88883*</e>
          <e id="id88884">*id88884*</e>